{
  "$schema": "http://json-schema.org/draft-07/schema#",
  "$id": "https://github.com/vladm3105/aidoc-flow-framework/blob/main/framework/governance/saga.schema.json",
  "title": "Review Saga Journal",
  "description": "Engine-agnostic schema for the per-run review saga journal. Spec authority: framework/governance/REVIEW_SAGA.md.",
  "type": "object",
  "additionalProperties": true,
  "required": [
    "review_run_id",
    "artifact_id",
    "layer",
    "personas_requested",
    "status",
    "iteration",
    "created_at",
    "updated_at",
    "branches",
    "transitions",
    "compensation_actions"
  ],
  "properties": {
    "review_run_id": {
      "type": "string",
      "minLength": 12,
      "description": "Deterministic or UUID run identifier."
    },
    "artifact_id": {
      "type": "string",
      "pattern": "^[A-Z]+-[0-9]{2,}$",
      "description": "Short artifact ID like BRD-01, PRD-02. Pattern matches the two-or-more-digit NN format of LAYER_REGISTRY.yaml id_patterns.document and ID_NAMING_STANDARDS.md §'Format' (three-plus-digit IDs like BRD-100 are registry-valid). The three surfaces must change in lockstep."
    },
    "layer": {
      "type": "string",
      "enum": [
        "01_BRD", "02_PRD", "03_EARS", "04_BDD",
        "05_ADR", "06_SPEC", "07_TDD", "08_IPLAN",
        "09_CHG"
      ]
    },
    "personas_requested": {
      "type": "array",
      "items": {"type": "string"},
      "minItems": 1
    },
    "status": {
      "type": "string",
      "enum": [
        "PREPARED", "FANOUT_STARTED",
        "BRANCH_RUNNING", "BRANCH_COMPLETED", "BRANCH_FAILED", "BRANCH_COMPENSATING",
        "FANIN_REDUCED", "SYNTHESIZED",
        "ESCALATED", "CLOSED", "PARTIAL_TIMEOUT"
      ]
    },
    "iteration": {
      "type": "integer",
      "minimum": 1
    },
    "created_at": {"type": "string", "format": "date-time"},
    "updated_at": {"type": "string", "format": "date-time"},
    "branches": {
      "type": "object",
      "additionalProperties": {
        "type": "object",
        "additionalProperties": true,
        "required": ["branch_id", "status", "attempt"],
        "properties": {
          "branch_id": {"type": "string", "minLength": 8},
          "status": {
            "type": "string",
            "enum": [
              "BRANCH_RUNNING", "BRANCH_COMPLETED",
              "BRANCH_FAILED", "BRANCH_COMPENSATING"
            ]
          },
          "attempt": {"type": "integer", "minimum": 0},
          "started_at": {"type": ["string", "null"], "format": "date-time"},
          "ended_at": {"type": ["string", "null"], "format": "date-time"},
          "error_code": {"type": ["string", "null"]}
        }
      }
    },
    "transitions": {
      "type": "array",
      "items": {
        "type": "object",
        "additionalProperties": false,
        "required": ["ts", "to", "scope"],
        "properties": {
          "ts": {"type": "string", "format": "date-time"},
          "from": {"type": ["string", "null"]},
          "to": {"type": "string"},
          "scope": {
            "type": "string",
            "pattern": "^(run|branch:[a-z_]+)$"
          }
        }
      }
    },
    "compensation_actions": {
      "type": "array",
      "items": {
        "type": "object",
        "additionalProperties": true,
        "required": ["ts", "branch", "reason", "action"],
        "properties": {
          "ts": {"type": "string", "format": "date-time"},
          "branch": {"type": "string"},
          "reason": {"type": "string"},
          "action": {
            "type": "string",
            "enum": ["retry", "skip", "escalate"]
          }
        }
      }
    },
    "document_fingerprint": {"type": "string"},
    "document_path": {"type": "string"},
    "current_phase": {
      "type": "string",
      "enum": ["draft", "review", "fixer", "re-review", "reduce", "synthesize"]
    },
    "retry_count": {"type": "integer", "minimum": 0}
  }
}
