{
  "review_run_id": "plugin-brd01-1a2b3c4d",
  "artifact_id": "BRD-01",
  "layer": "01_BRD",
  "personas_requested": [
    "business_analyst",
    "architect",
    "chaos_engineer",
    "security_engineer",
    "auditor"
  ],
  "status": "CLOSED",
  "iteration": 1,
  "current_phase": "synthesize",
  "created_at": "2026-06-10T17:09:08.829368+00:00",
  "updated_at": "2026-06-10T17:50:28.203332+00:00",
  "branches": {
    "business_analyst": {"branch_id": "ba0011223344", "status": "BRANCH_COMPLETED", "attempt": 0, "started_at": "2026-06-10T17:21:31.522057+00:00", "ended_at": "2026-06-10T17:21:41.522057+00:00"},
    "architect": {"branch_id": "ar0011223344", "status": "BRANCH_COMPLETED", "attempt": 0, "started_at": "2026-06-10T17:22:04.798059+00:00", "ended_at": "2026-06-10T17:22:14.798059+00:00"},
    "chaos_engineer": {"branch_id": "ch0011223344", "status": "BRANCH_COMPLETED", "attempt": 0, "started_at": "2026-06-10T17:22:16.306059+00:00", "ended_at": "2026-06-10T17:22:26.306059+00:00"},
    "security_engineer": {"branch_id": "se0011223344", "status": "BRANCH_COMPLETED", "attempt": 0, "started_at": "2026-06-10T17:22:28.100000+00:00", "ended_at": "2026-06-10T17:22:38.100000+00:00"},
    "auditor": {"branch_id": "au0011223344", "status": "BRANCH_COMPLETED", "attempt": 0, "started_at": "2026-06-10T17:22:40.100000+00:00", "ended_at": "2026-06-10T17:22:50.100000+00:00"}
  },
  "transitions": [
    {"ts": "2026-06-10T17:09:08.829381+00:00", "from": null, "to": "PREPARED", "scope": "run"},
    {"ts": "2026-06-10T17:18:33.271544+00:00", "from": "PREPARED", "to": "FANOUT_STARTED", "scope": "run"},
    {"ts": "2026-06-10T17:21:31.522057+00:00", "from": "FANOUT_STARTED", "to": "BRANCH_RUNNING", "scope": "branch:business_analyst"},
    {"ts": "2026-06-10T17:21:41.522057+00:00", "from": "BRANCH_RUNNING", "to": "BRANCH_COMPLETED", "scope": "branch:business_analyst"},
    {"ts": "2026-06-10T17:45:00.000000+00:00", "from": "BRANCH_COMPLETED", "to": "FANIN_REDUCED", "scope": "run"},
    {"ts": "2026-06-10T17:48:00.000000+00:00", "from": "FANIN_REDUCED", "to": "SYNTHESIZED", "scope": "run"},
    {"ts": "2026-06-10T17:50:28.203332+00:00", "from": "SYNTHESIZED", "to": "CLOSED", "scope": "run"}
  ],
  "compensation_actions": []
}
